{
    "$schema": "urn:pickle:schemas:artefacts:domains:data:conceptual:DAT-STR",
    "audience": [
        "Enterprise Architect",
        "Data Architect",
        "Chief Data Officer"
    ],
    "author": [
        "Data Architect",
        "Data Analyst"
    ],
    "strategies": [
        {
            "id": "DAT-STR-001",
            "statement": "Treat data as a product — each domain publishes data assets consumed by the rest of the business",
            "driver": "Data is the second-most expensive asset and frequently the least managed; consumers cannot rely on what they cannot inspect",
            "target-outcome": "Top 30 data assets published as discoverable, versioned products with SLAs by end of 2026",
            "horizon": "medium-term",
            "owner": "Chief Data Officer"
        },
        {
            "id": "DAT-STR-002",
            "statement": "Federate data ownership to domain teams; centralise only standards and platform",
            "driver": "Central data teams become bottlenecks and lose subject-matter context; pure decentralisation creates incompatible silos",
            "target-outcome": "Every data product has a named domain owner; a single self-service platform with shared standards by 2026",
            "horizon": "medium-term",
            "owner": "Chief Data Officer"
        },
        {
            "id": "DAT-STR-003",
            "statement": "Default to self-service; specialist data teams support domains, not gate them",
            "driver": "Ticket-based data access models scale poorly and breed shadow data pipelines",
            "target-outcome": "80% of analytics use cases satisfied without bespoke pipeline work; specialist teams allocated to platform improvements",
            "horizon": "medium-term",
            "owner": "Head of Data Platform"
        },
        {
            "id": "DAT-STR-004",
            "statement": "Privacy and consent are designed in, not bolted on",
            "driver": "GDPR, CCPA, and equivalent regimes treat privacy failures as systemic, not isolated",
            "target-outcome": "All personal-data flows traceable to a consent record; data classifications enforced at storage and access",
            "horizon": "short-term",
            "owner": "Chief Data Protection Officer"
        },
        {
            "id": "DAT-STR-005",
            "statement": "Move to real-time data where it changes a decision; keep batch where it doesn't",
            "driver": "Real-time is expensive; applying it indiscriminately wastes money. Withholding it where the decision is time-sensitive loses value",
            "target-outcome": "Stream-first architecture for time-sensitive domains (trading, network ops, customer engagement); batch retained for periodic reporting",
            "horizon": "medium-term",
            "owner": "Chief Data Officer"
        },
        {
            "id": "DAT-STR-006",
            "statement": "Lineage and provenance are non-negotiable for every data product",
            "driver": "Decisions made on data of unknown provenance cannot be defended or improved",
            "target-outcome": "End-to-end lineage available for every published data product; automated provenance metadata captured at point of production",
            "horizon": "medium-term",
            "owner": "Head of Data Governance"
        }
    ],
    "activity": [
        {
            "timestamp": "2026-01-15T09:30:00Z",
            "action": "Created",
            "who": "Joe B",
            "notes": "Initial baseline for version 1.0.0."
        },
        {
            "timestamp": "2026-03-04T14:10:00Z",
            "action": "Updated",
            "who": "Joe B",
            "notes": "Reviewed and refined during the 2026-Q1 architecture cycle."
        }
    ]
}
