{
    "$schema": "urn:pickle:schemas:artefacts:domains:application:conceptual:APP-STR",
    "audience": [
        "Enterprise Architect",
        "Application Architect",
        "Chief Information Officer"
    ],
    "author": [
        "Application Architect",
        "Systems Analyst"
    ],
    "strategies": [
        {
            "id": "APP-STR-001",
            "statement": "Cloud-native first — every new application is designed for the cloud operating model, regardless of where it ultimately runs",
            "driver": "Cloud-native patterns (containers, immutability, observability, declarative infrastructure) are now the baseline expectation for operability",
            "target-outcome": "100% of new applications cloud-native by 2025; legacy estate reduced 50% by 2027",
            "horizon": "medium-term",
            "owner": "Head of Application Architecture"
        },
        {
            "id": "APP-STR-002",
            "statement": "Buy or assemble for commodity capability; build only where it differentiates",
            "driver": "Custom-built commodity systems consume disproportionate maintenance budget vs. the differentiation they provide",
            "target-outcome": "Custom-build share of total portfolio below 40% by 2027; build effort concentrated on differentiating capabilities",
            "horizon": "medium-term",
            "owner": "Head of Application Architecture"
        },
        {
            "id": "APP-STR-003",
            "statement": "Compose capabilities from independent, replaceable services — monoliths are exceptions",
            "driver": "Monolithic applications concentrate risk and constrain pace; composable architectures enable independent evolution",
            "target-outcome": "No new monoliths approved; existing monoliths have a documented decomposition plan or sunset date",
            "horizon": "long-term",
            "owner": "Head of Application Architecture"
        },
        {
            "id": "APP-STR-004",
            "statement": "Continuous delivery is the default operating model",
            "driver": "Release-cycle batching hides quality problems and slows learning",
            "target-outcome": "All applications deploy on demand via automated pipelines by 2026; release calendars retired",
            "horizon": "medium-term",
            "owner": "Head of Engineering"
        },
        {
            "id": "APP-STR-005",
            "statement": "Observability is a first-class capability — applications expose health, behaviour, and business signals",
            "driver": "Incidents in unobservable systems cost disproportionately to investigate",
            "target-outcome": "Standard observability (logs / metrics / traces) on every production service; business-outcome telemetry on every customer-facing flow",
            "horizon": "short-term",
            "owner": "Head of SRE"
        },
        {
            "id": "APP-STR-006",
            "statement": "Polyglot persistence — match the data store to the workload, not vice versa",
            "driver": "A single shared database constrains every service to its lowest-common-denominator capability",
            "target-outcome": "Each service owns its primary data store, selected for fit; canonical data published as products (per DAT)",
            "horizon": "medium-term",
            "owner": "Head of Application Architecture"
        }
    ],
    "activity": [
        {
            "timestamp": "2026-01-15T09:30:00Z",
            "action": "Created",
            "who": "Joe B",
            "notes": "Initial baseline for version 1.0.0."
        },
        {
            "timestamp": "2026-03-04T14:10:00Z",
            "action": "Updated",
            "who": "Joe B",
            "notes": "Reviewed and refined during the 2026-Q1 architecture cycle."
        }
    ]
}
